{
  "artifacts": {
    "manifest.json": "69465ea97bdb6c4e77a05a620c97f5a992cb86bdba0250163421d0a02d8ecd19",
    "parity_run_results.json": "2007f4f8c073f4ee0f384e2f04074ebccfe1bbdea8119010631323440121ec26",
    "run_results.json": "685c228d025b1172a39d0ebca250f2164ad095966c3816fe9b6d58f10e384b1c"
  },
  "authority": "derived-evidence-only",
  "blocking_reasons": [],
  "command": "build",
  "completed_at": "2026-07-19T20:29:52.851Z",
  "elapsed_seconds": 59.179,
  "executed_unique_ids": [
    "model.seshat_bi.audit_sales_c086_raw_parity",
    "model.seshat_bi.dim_billing_type_c086",
    "model.seshat_bi.dim_customer_c086",
    "model.seshat_bi.dim_date_c086",
    "model.seshat_bi.dim_product_c086",
    "model.seshat_bi.dim_staff_c086",
    "model.seshat_bi.fct_sales_c086",
    "model.seshat_bi.stg_sales_c086_raw",
    "test.seshat_bi.not_null_audit_sales_c086_raw_parity_assertion_id.d5bf137fdb",
    "test.seshat_bi.not_null_dim_billing_type_c086_billing_type_sk.9e9e7a5e35",
    "test.seshat_bi.not_null_dim_customer_c086_customer_sk.c5c66d6097",
    "test.seshat_bi.not_null_dim_date_c086_date_sk.44f768715d",
    "test.seshat_bi.not_null_dim_product_c086_product_sk.a319073040",
    "test.seshat_bi.not_null_dim_staff_c086_staff_sk.f3998e42ed",
    "test.seshat_bi.not_null_fct_sales_c086_date_sk.7eeba120ab",
    "test.seshat_bi.not_null_fct_sales_c086_fct_sales_c086_sk.65d499b41d",
    "test.seshat_bi.not_null_stg_sales_c086_raw_item_no.0d8dc68032",
    "test.seshat_bi.not_null_stg_sales_c086_raw_reference_no.69074cf834",
    "test.seshat_bi.relationships_fct_sales_c086_billing_type_sk__billing_type_sk___ref_dim_billing_type_c086_.0f70f32f25",
    "test.seshat_bi.relationships_fct_sales_c086_customer_sk__customer_sk___ref_dim_customer_c086_.635eb76b22",
    "test.seshat_bi.relationships_fct_sales_c086_date_sk__date_sk___ref_dim_date_c086_.71607a5ce7",
    "test.seshat_bi.relationships_fct_sales_c086_product_sk__product_sk___ref_dim_product_c086_.21284c4b9c",
    "test.seshat_bi.relationships_fct_sales_c086_staff_sk__staff_sk___ref_dim_staff_c086_.4c4e09215e",
    "test.seshat_bi.unique_audit_sales_c086_raw_parity_assertion_id.877e06076a",
    "test.seshat_bi.unique_dim_billing_type_c086_billing_type_sk.a9b5dd2297",
    "test.seshat_bi.unique_dim_customer_c086_customer_sk.6e044978c1",
    "test.seshat_bi.unique_dim_date_c086_date_sk.5237f4355b",
    "test.seshat_bi.unique_dim_product_c086_product_sk.1e8fa21627",
    "test.seshat_bi.unique_dim_staff_c086_staff_sk.0cdaa83328",
    "test.seshat_bi.unique_fct_sales_c086_fct_sales_c086_sk.d02219b357"
  ],
  "invocation_id": "20260719T202853Z-2c315da5",
  "mapping_path": "mappings/sales_c086_raw/source-map.yaml",
  "mapping_revision": "dff492ff457d37006d050a50c3e7b32f61c35783",
  "outcome": "pass",
  "parity": [
    {
      "actual": "11",
      "assertion_class": "dimension_member_count",
      "assertion_id": "dim_billing_type_member_count",
      "delta": "0",
      "expected": "11",
      "passed": true,
      "subject": "dim_billing_type_c086",
      "tolerance": "0"
    },
    {
      "actual": "639",
      "assertion_class": "dimension_member_count",
      "assertion_id": "dim_customer_member_count",
      "delta": "0",
      "expected": "639",
      "passed": true,
      "subject": "dim_customer_c086",
      "tolerance": "0"
    },
    {
      "actual": "1096",
      "assertion_class": "dimension_member_count",
      "assertion_id": "dim_date_member_count",
      "delta": "0",
      "expected": "1096",
      "passed": true,
      "subject": "dim_date_c086",
      "tolerance": "0"
    },
    {
      "actual": "9669",
      "assertion_class": "dimension_member_count",
      "assertion_id": "dim_product_member_count",
      "delta": "0",
      "expected": "9669",
      "passed": true,
      "subject": "dim_product_c086",
      "tolerance": "0"
    },
    {
      "actual": "257",
      "assertion_class": "dimension_member_count",
      "assertion_id": "dim_staff_member_count",
      "delta": "0",
      "expected": "257",
      "passed": true,
      "subject": "dim_staff_c086",
      "tolerance": "0"
    },
    {
      "actual": "248593",
      "assertion_class": "business_key_count",
      "assertion_id": "fact_distinct_grain_key",
      "delta": "0",
      "expected": "248593",
      "passed": true,
      "subject": "fct_sales_c086.reference_no.item_no",
      "tolerance": "0"
    },
    {
      "actual": "38804001.54",
      "assertion_class": "additive_money_total",
      "assertion_id": "fact_gross_sales_sum",
      "delta": "0",
      "expected": "38804001.54",
      "passed": true,
      "subject": "fct_sales_c086.gross_sales",
      "tolerance": "0.01"
    },
    {
      "actual": "248593",
      "assertion_class": "fact_row_count",
      "assertion_id": "fact_row_count",
      "delta": "0",
      "expected": "248593",
      "passed": true,
      "subject": "fct_sales_c086",
      "tolerance": "0"
    }
  ],
  "plan_digest": "b3aed02ebb9e7971f370ae96418877aa2369f5962a2585e54bd114825d6fae4b",
  "project_fingerprint": "28ab3c1f3808feb4cee1521980cd8d34e280455889ea0be1445397c8900cbaaf",
  "readiness_effect": "none; named-human approval required",
  "runtime": {
    "dbt_adapter": "dbt-postgres",
    "dbt_adapter_version": "1.10.2",
    "dbt_core": "1.12.0"
  },
  "schema_version": 1,
  "selected_unique_ids": [
    "model.seshat_bi.audit_sales_c086_raw_parity",
    "model.seshat_bi.dim_billing_type_c086",
    "model.seshat_bi.dim_customer_c086",
    "model.seshat_bi.dim_date_c086",
    "model.seshat_bi.dim_product_c086",
    "model.seshat_bi.dim_staff_c086",
    "model.seshat_bi.fct_sales_c086",
    "model.seshat_bi.stg_sales_c086_raw",
    "test.seshat_bi.not_null_audit_sales_c086_raw_parity_assertion_id.d5bf137fdb",
    "test.seshat_bi.not_null_dim_billing_type_c086_billing_type_sk.9e9e7a5e35",
    "test.seshat_bi.not_null_dim_customer_c086_customer_sk.c5c66d6097",
    "test.seshat_bi.not_null_dim_date_c086_date_sk.44f768715d",
    "test.seshat_bi.not_null_dim_product_c086_product_sk.a319073040",
    "test.seshat_bi.not_null_dim_staff_c086_staff_sk.f3998e42ed",
    "test.seshat_bi.not_null_fct_sales_c086_date_sk.7eeba120ab",
    "test.seshat_bi.not_null_fct_sales_c086_fct_sales_c086_sk.65d499b41d",
    "test.seshat_bi.not_null_stg_sales_c086_raw_item_no.0d8dc68032",
    "test.seshat_bi.not_null_stg_sales_c086_raw_reference_no.69074cf834",
    "test.seshat_bi.relationships_fct_sales_c086_billing_type_sk__billing_type_sk___ref_dim_billing_type_c086_.0f70f32f25",
    "test.seshat_bi.relationships_fct_sales_c086_customer_sk__customer_sk___ref_dim_customer_c086_.635eb76b22",
    "test.seshat_bi.relationships_fct_sales_c086_date_sk__date_sk___ref_dim_date_c086_.71607a5ce7",
    "test.seshat_bi.relationships_fct_sales_c086_product_sk__product_sk___ref_dim_product_c086_.21284c4b9c",
    "test.seshat_bi.relationships_fct_sales_c086_staff_sk__staff_sk___ref_dim_staff_c086_.4c4e09215e",
    "test.seshat_bi.unique_audit_sales_c086_raw_parity_assertion_id.877e06076a",
    "test.seshat_bi.unique_dim_billing_type_c086_billing_type_sk.a9b5dd2297",
    "test.seshat_bi.unique_dim_customer_c086_customer_sk.6e044978c1",
    "test.seshat_bi.unique_dim_date_c086_date_sk.5237f4355b",
    "test.seshat_bi.unique_dim_product_c086_product_sk.1e8fa21627",
    "test.seshat_bi.unique_dim_staff_c086_staff_sk.0cdaa83328",
    "test.seshat_bi.unique_fct_sales_c086_fct_sales_c086_sk.d02219b357"
  ],
  "seshat_exit_code": 0,
  "started_at": "2026-07-19T20:28:53.672Z",
  "table_id": "sales_c086_raw",
  "target": {
    "name": "shadow",
    "schemas": {
      "audit": "seshat_dbt_shadow_audit",
      "gold": "seshat_dbt_shadow_gold",
      "silver": "seshat_dbt_shadow_silver"
    }
  },
  "tests": {
    "errored": 0,
    "failed": 0,
    "passed": 22,
    "skipped": 0
  }
}
